{
  "title": "Quality threshold adjustment",
  "action_id": "act-demo-001",
  "decision_id": "decision-demo-001",
  "profile": "quality",
  "owner": "action-owner",
  "metric_owner": "metric-owner",
  "method": "matched_comparison",
  "threshold": 0.05,
  "guardrail_limit": 0.01,
  "baseline_days": 14,
  "start_day": 7,
  "end_day": 21,
  "lag_days": 2,
  "sla_days": 3,
  "min_count": 100,
  "freshness_hours": 24,
  "max_bytes": 1000000,
  "scenario": "improved",
  "seed": 42,
  "confounders": [],
  "plan_ref": "demo://plans/quality-threshold",
  "config_ref": "demo://config/threshold-v2",
  "cohort_ref": "demo://cohorts/matched-line",
  "rationale": "Measure a predeclared outcome after an authorized synthetic action."
}
